<?xml version="1.0" encoding="utf-8" ?>
<contacts xmlns="http://msiter.ru"
xmlns:xsi="http://www.w3.org/2001/XMLSchema-instance"
xsi:schemaLocation="http://msiter.ru Contacts.xsd">
  <contact Id="0">
    <FirstName>Vlad</FirstName>
    <SecondName>Lee</SecondName>
    <Number>89011234567</Number>
    <EMail>vlad.lee@mail.ru</EMail>
  </contact>
  <contact Id="1">
    <FirstName>Andrey</FirstName>
    <SecondName>Tyu</SecondName>
    <Number>89020458673</Number>
    <EMail>jambotoyou@gmail.com</EMail>
  </contact>
</contacts>
